Réf.	Libellé	Type	
201313-B	FEU DE POSITION LATÉRAL NÉON LED	0	
201313-K	FEU DE POSITION LATÉRAL NÉON LED	0	
201313-S	FEU DE POSITION LATÉRAL NÉON LED	0	
201409-SK	FEU LATERAL LONG	0	
201502-SK	FEU LATERAL COURT	0	
201601-B	FEU DE POSITION LATERAL OVAL LED	0	
201601-K	FEU DE POSITION LATERAL OVAL LED	0	
201601-S	FEU DE POSITION LATERAL OVAL LED	0	
201610	LAMPE DE TRAVAIL LED CARRÉE	0	
201611	LAMPE DE TRAVAIL LED ROND	0	
201701-B	FEU DE POSITION LATÉRALE LED	0	
201701-S	FEU DE POSITION LATÉRALE LED	0	
201705-24V	FEU ARRIERE ROND LED	0	
201706-24V	FEU ARRIERE NÉON LED 24V	0	
201710-S	FEU DE POSITION LATÉRALE LED 2 LEDS	0	
201901-24V	FEU ARRIERE NEON DYNAMIC LED 24V	0	
201905-B	FEU DE POSITION LATÉRAL NÉON LED	0	
201905-K	FEU DE POSITION LATÉRAL NÉON LED	0	
201905-S	FEU DE POSITION LATÉRAL NÉON LED	0	
201910-B	FEU DE POSITION LATÉRAL NÉON LED	0	
201910-K	FEU DE POSITION LATÉRAL NÉON LED	0	
201910-S	FEU DE POSITION LATÉRAL NÉON LED	0	
202007-D_LH	COBRA DYNAMIC SIGNAL MARKER FEU LH	0	
202007-D_RH	COBRA DYNAMIC SIGNAL MARKER FEU RH	0	
202008-D_LH	DYNAMIC SIGNAL MARKER LH	0	
202008-D_RH	DYNAMIC SIGNAL MARKER RH	0	
202010	LAMPE DE TRAVAIL CARRÉE 16LED	0	
202020-B	FEU DE POSITION LATÉRAL AVEC 24 LEDS	0	
202020-K	FEU DE POSITION LATÉRAL AVEC 24 LEDS	0	
202020-S	FEU DE POSITION LATÉRAL AVEC 24 LEDS	0	
202101-D	FEU ARRIERE CARRE DYNAMIC NEON LED	0	
202107	LAMPE DE TRAVAIL LED CARRÉE	0	
202109_GV	FEU ARRIERE HAMBURGER	0	
202110-24V	FEU COMBINÉ ARRIÈRE LED NÉON	0	
202112	LAMPE DE TRAVAIL LED CARRÉE	0	
202113	LAMPE DE TRAVAIL LED ROND	0	
202114	LAMPE DE TRAVAIL LED ROND	0	
202116	LAMPE DE TRAVAIL LED ROND	0	
202119	LAMPE DE TRAVAIL LED ROND	0	
326030	FEU COMBINÉ ARRIÈRE 7 CHAMBRE	0	
326030-C	CABOCHON DE FEU ARRIÈRE 8 CHMBR	0	
ENS.3.10.0002	RÉSERVOIR D'EAU PLASTIQUE 30LT	0	
ENS.3.10.0005	COFFRET EXTINCTEUR 6-9KG	0	
ENS.3.10.0500	AVERTISSEUR D'AIR SIMPLE-ROUGE	0	
ENS.3.10.0461	AVERTISSEUR PNEUMATIQUE À 3TUBES - CHROME	0	
11217	DURITE INTERCOOLER MAN 8R	0	
29487	CABLE DE REGLAGE DE LACOLONNE DE DIRECTION	0	
34247	ARRET D'HUIL MOYEU DAF 100x140x15	0	
17992	ARRET D'HUIL MOYEU MAN AR 139x175x16,3	0	
25306	POMPE D'ESSUIE-GLACE VOLVO FH/FM	0	
14738	POIGNET DE LEVIER DE VITESSE VOLVO FH/FM	0	
19529	POMPE D'ESSUIE-GLACE MAN/SCANIA/MERCEDES	0	
24128	CLAPIE DE GAZOIL SCANIA	0	
15231	CLAPET ANTIRETOUR VOLVO FH/FM	0	
18000	ARRET D'HUIL MOYEU VOLVO AR 168x192x188x30	0	
22209	KIT D'ARRET D'HUIL MOYEU VOLVO FH/FM 125x148	0	
15935	VALVE DE NIVELEMENT MAN/DAF/VOLVO/RENAULT	0	
17034	BOUCHON RESERVOIRE VOLVO FH/RVI440	0	
13955	DECLENCHEUR STD FR	0	
12126	APPAREILLE PEDAL FREINS STD	0	
14825	VASE D'EXPANSSION RENAULT PREMIUM/KERAX	0	
15805	POMPE D'EMBRAYAGE SCANIA 360	0	
16335	AMORTISSEUR CALANDRE MAN TGA 145MM-350N	0	
16985	POMPE D'EMBRAYAGE SCANIA 360/380	0	
18836	TENDEUR DE COURROIE VOLVO FH/FM	0	
19606	CAPTEUR DE PRESSION D'AIR MAN/DAF/SCANIA/IVECO	0	
28211	POMPE D'ESSUIE-GLASSE RENAULT 440	0	
17812	VALVE RELAIS MAN/DAF/SCANIA/MERCEDES	0	
24150	VASE D'EXPANSSION VOLVO FH400 AVEC CAPTEUR	0	
18159	BOUCHON VASE D'EXPANSSION VOLVO FH/FM	0	
37348	KIT DE JOINT REFROIDISSEUR D'HUIL SCANIA 360	0	
17726	VALVE DE NIVELEMENT SCANIA	0	
36451	MANETTE FREINS A MAIN RVI PREMIUM/KERAX/VOLVO	0	
21220	CABLE VITESSE VOLVO FH/FM GRIS 2915mm	0	
19750	CABLE VITESSE VOVLO FH NOIR 2750MM	0	
16051	TENDEUR DE COURROIE VOLVO FH/FM	0	
15355	SUPPORT VENTULATEUR MAN TGA/TGS/TGX	0	
33932	PIPE POMPE A EAU VOLVO/RENAULT	0	
14885	VASE D'EXPANSSION VOLVO FH/B9/B10/B12	0	
16964	VASE D'EXPANSSION SCANIA 360/380	0	
25078	VASE D'EXPANSSION DAF CF	0	
21904	JOINT REFROIDISSEUR D'HUIL MAN TGA/TGS/TGX	0	
19434	DURITE RADIATEUR SCANIA 50/56x430 mm	0	
15953	DURITE INTERCOOLER VOLVO FH/FM/B9/B12 82x106x147	0	
14762	DURITE INTERCOOLER VOLVO FH/FM/B9/B12 81x105x150	0	
20511	CAPTEUR ABS VOLVO/RENAULT/IVECO/MAN	0	
10728	KIT POMPE D'ALIMENTATION MAN/MERCEDES	0	
37456	VALVE DE SECURITE DAF XF 95	0	
21801	SWITCH DE COMMANDE VOLVO FH/FM	0	
16340	DECLENCHEUR STD PL	0	
14737	POIGNET DE LEVIER VITESSE VOLVO FH12/F12/F10/NL	0	
31396	INTEREPTEUR LEVE VITRE SCANIA	0	
36219	CAPTEUR PEDAL ACCELERATEUR VOLVO/RENAULT/DAF/IVECO	0	
14938	BOUCHON RESERVOIR SCANIA	0	
14736	POIGNET DE LEVIER VITESSE VOLVO FH/FM	0	
20124	CLAPIE DE GAZOIL MAN TGA	0	
17846	VALVE DE SECURITE RENAULT	0	
32574	POMPE D'EMBRAYAGE VOLVO FH/FM/FMX	0	
16988	POIGNET DE LEVIER VITESSE SCANIA 124 360	0	
21213	VALVE DE SECURITE VOLVO FH/FM 420/400/440	0	
10929	TUYEAU D'EAU MAN	0	
18039	CABLE VITESSE VOLVO FH NOIR 2650mm	0	
15538	DESSICATEUR D'AIR STD	0	
17702	FEU DE SIGNAL SCANIA LH	0	
17701	FEU DE SIGNAL SCANIA RH	0	
18358	POMPE D'ALIMENTATION MAN TGA	0	
15101	FEU DE SIGNAL RENAULT PREMIUM/KERAX LH	0	
15100	FEU DE SIGNAL RENAULT PREMIUM/KERAX RH	0	
39876	ARRET D'HUILE ROUE AR RVI 120X150X15	0	
38170	AMORTISSEUR CALENDRE MAN TGA 315MM / 120N	0	
14952	BARRILLET DE PORTE SCANIA	0	
15603	CABLE VITESSE MAN TGA/TGS GRIS	0	
15602	CABLE VITESSE MAN TGA/TGS NOIR	0	
15214	JOINT REFROIDISSEUR D'HUIL MERCEDES ACTROS/TRAVEGO	0	
27247	TENDEUR DE COURROIE RENAULT PREMIUM 440	0	
30261	TUYEAU D'EAU SCANIA	0	
37455	VALVE CHARGE RAPIDE M16	0	
17718	INTEREPTEUR SCANIA	0	
19003	POMPE D'EMBRAYAGE MAN TGA/TGS/TGX	0	
16199	BUTEE D'EMBRAYAGE MAN/DAF/IVECO	0	
20397	POMPE D'ALIMENTATION MAN/MERCEDES/DAF	0	
21676	VALVE RELAIS MAN TGA/TGS/TGX	0	
31907	POIGNET DE LEVIER VITESSE RENAULT PREMIUM 440	0	
26031	COUPE COURANT VOLVO/RENAULT	0	
28390	JOINT REFREJIRANT SCANIA ALM	0	
20097	SWITCH DE COMMANDE VOLVO FH/FM	0	
33769	KIT DE JOINT REFROIDISSEUR DAF CF/XF	0	
18639	DESSICATEUR D'AIR MERCEDES ACTROS/AXOR	0	
20137	BUTEE D'EMBRAYAGE RENAULT KERAX	0	
19725	POMPE D'EMBRAYAGE RENAULT PREMIUM 440	0	
11431	JOINT REFREGIRANT MAN TGA	0	
24444	TENDEUR DE COURROIE DAF XF 105	0	
52908	AMOURTISSEUR CABINE DAF AR CF85/CF75	0	
52907	AMOURTISSEUR CABINE DAF AR CF85/CF75	0	
52906	AMOURTISSEUR CABINE DAF AR XF95/XF105	0	
52901	AMOURTISSEUR CABINE DAF AR XF95/XF105	0	
52905	AMOURTISSEUR CABINE DAF AV CF85/CF75	0	
52900	AMOURTISSEUR CABINE DAF AV XF95/XF105	0	
53304	AMOURTISSEUR CABINE IVECO STRALIS AR	0	
53301	AMOURTISSEUR CABINE IVECO STRALIS AV	0	
52306	AMOURTISSEUR CABINE MAN AR TGA/TGS	0	
52304	AMOURTISSEUR CABINE MAN AV TGA/TGS	0	
52502	AMOURTISSEUR CABINE REMAULT AV PREMIUM/KERA	0	
52501	AMOURTISSEUR CABINE RENAULT AR PREMIUM/KERAX	0	
52701	AMOURTISSEUR CABINE SCANIA AR	0	
52703	AMOURTISSEUR CABINE SCANIA AR	0	
72703	COUSSIN D'AIR CABINE SCANIA AV COMPLET	0	
52707	AMOURTISSEUR CABINE SCANIA AV	0	
53103	AMOURTISSEUR CABINE VOLVO AR FH/FM	0	
53106	AMOURTISSEUR CABINE VOLVO AV/AR F10/F12/F16	0	
53102	AMOURTISSEUR CABINE VOLVO FH/FM AR	0	
53104	AMOURTISSEUR CABINE VOLVO FH/FM AR	0	
72306	COUSSIN D'AIR CABINE MAN AR TGA/TGS/TGX	0	
72303	COUSSIN D'AIR CABINE MAN AR TGA/TGS/TGX	0	
72308	COUSSIN D'AIR CABINE MAN AR TGA/TGS/TGX	0	
72300	COUSSIN D'AIR CABINE MAN AV TGA/TGS/TGX	0	
72302	COUSSIN D'AIR CABINE MAN AV TGA/TGS/TGX	0	
72500	COUSSIN D'AIR CABINE RENAULT AR PREMIUM	0	
72501	COUSSIN D'AIR CABINE RENAULT AR PREMIUM/KERAX	0	
72506_92500	COUSSIN D'AIR CABINE RENAULT AV PREMIUM/KERAX	0	
72705-K	COUSSIN D'AIR CABINE SCANIA AR 4SERIE	0	
72703-K	COUSSIN D'AIR CABINE SCANIA AV/AR 4SERIE	0	
72708-K	COUSSIN D'AIR CABINE SCANIA AV/AR 4SERIE	0	
72713-K	COUSSIN D'AIR CABINE SCANIA AV/AR 4SERIE	0	
73100	COUSSIN D'AIR CABINE VOLVO AR FH12/FH16	0	
73103	COUSSIN D'AIR CABINE VOLVO AV FH/FM	0	
73101	COUSSIN D'AIR CABINE VOLVO AV FH12/FH16	0	
72710	COUSSIN D'AIR CABINE SCANIA 410 AV	0	
73102	COUSSIN D'AIR CABINE VOLVO FH AV	0	
OSY_1021	KIT SELETTE 3 TR	0	
OSY_1022	CROCHE SELETTE	0	
OSY_1046	VERROU SELETTE	0	
OSY_1066	KIT CAOUTCHOUC SELETTE	0	
OSY_1072	KIT SELETTE 4 TR	0	
OSY_1050	CROCHE SELETTE NV MODEL	0	
OSY_1069	KIT SELETTE 2TR NV MODEL	0	
OSY_1129	KIT SELETTE 3 TR AVEC CROCHE	0	
OSY_1008	PIVOT AVEC ECROU 2	0	
OSY_1007-3	JEU DE BOULON PIVOT	0	
ZEP0001603	COMPRESSEUR DAF CF/XF	0	
ZEP0000482	COMPRESSEUR MAN TGA/TGS/TGX	0	
ZEP0001618	COMPRESSEUR RENAULT KERAX 400	0	
ZEP0001536	COMPRESSEUR RENAULT PREMIUM 440	0	
ZEP0001588	COMPRESSEUR SCANIA 360	0	
ZEP0001554	COMPRESSEUR VOLVO NL10	0	
ZEP0004332	COUVERT REFROIDISSEUR SCANIA 360	0	
ZEP0002691	CULASSE COMPRESSEUR DAF CF/XF	0	
ZEP0002716	CULASSE COMPRESSEUR DAF PACCARD	0	
ZEP0003552	CULASSE COMPRESSEUR MAN TGA	0	
ZEP0003535	CULASSE COMPRESSEUR MAN TGA	0	
ZEP0002796	CULASSE COMPRESSEUR RENAULT KERAX 400	0	
ZEP0002497	CULASSE COMPRESSEUR RENAULT PREMIUM	0	
ZEP0004005	CULASSE COMPRESSEUR SCANIA 360	0	
ZEP0003602	CULASSE COMPRESSEUR VOLVO FH/FM	0	
ZEP0003573	CULASSE COMPRESSEUR VOLVO FH/FM 1P	0	
ZEP0001879	CYLINDER COMPRESSEUR MAN 90mm	0	
ZEP0005388	DESSICATER D'AIR STD	0	
ZEP0008389	DESSICATEUR D'AIR MERCEDES/DAF	0	
ZEP0002705	KIT COMPRESSEUR DAF 95XF/CF85/CF75	0	
ZEP0002719	KIT COMPRESSEUR DAF PACCARD	0	
ZEP0002854	KIT COMPRESSEUR IVECO STRALIS	0	
ZEP0002858	KIT COMPRESSEUR IVECO STRALIS TRAKKER	0	
ZEP0002265	KIT COMPRESSEUR MAN TGA	0	
ZEP0003548	KIT COMPRESSEUR MAN TGA	0	
ZEP0002339	KIT COMPRESSEUR MAN TGA/TGS/TGX	0	
ZEP0002277	KIT COMPRESSEUR MAN TGA/TGS/TGX	0	
ZEP0003427	KIT COMPRESSEUR MERCEDES ACTROS	0	
ZEP0002798	KIT COMPRESSEUR RENAULT KERAX 400	0	
ZEP0002499	KIT COMPRESSEUR RENAULT PREMIUM 440	0	
ZEP0003085	KIT COMPRESSEUR RENAULT R310/330/340	0	
ZEP0003647	KIT COMPRESSEUR VOLVO / SCANIA	0	
ZEP0002629	KIT COMPRESSEUR SCANIA R410	0	
ZEP0003672	KIT COMPRESSEUR VOLVO F10/F12	0	
ZEP0002552	KIT COMPRESSEUR VOLVO F10/F12/FM10	0	
ZEP0002534	KIT COMPRESSEUR VOLVO FH/FM 1P	0	
ZEP0002542	KIT COMPRESSEUR VOLVO FH/FM	0	
ZEP0002456	KIT COMPRESSEUR VOLVO NL10	0	
ZEP0002405	KIT COMRESSEUR VOLVO/SCANIA	0	
Z07K002	KIT REPARATION DECLENCHEUR METAL	0	
ZEP0015703	KIT REPARATION DESSICATEUR	0	
ZEP0001217	KIT REPARATION SERVEAU D'EMBRAYAGE MAN TGA	0	
ZEP0001246	KIT REPARATION SERVEAU D'EMBRAYAGE RENAULT KERAX	0	
ZEP0001278	KIT REPARATION SERVEAU D'EMBRAYAGE SCANIA 360	0	
ZEP0005205	KIT REPARATION SERVEAU D'EMBRAYAGE SCANIA 380	0	
ZEP0001286	KIT REPARATION SERVEAU D'EMBRAYAGE VOLVO F10/N10	0	
ZEP0007175	KIT REPARATION VALVE FRUEHAUF BAL	0	
ZEP0002678	PISTON + SEGEMENT 75,00 STD 2X2X4	0	
ZEP0002805	PISTON + SEGEMENT 78.00 STD 2,5X2,5X4	0	
ZEP0002000	PISTON + SEGEMENT 86.00 STD	0	
ZEP0001929	PISTON + SEGEMENT 88.00 STD 2,5x2,5x4	0	
ZEP0001846	PISTON + SEGEMENT 90.00 STD 2,5x2,5x4	0	
ZEP0001961	PISTON+SEGEMENT 85,00 STD 2x2x4	0	
ZEP0001364	POMPE D'EMBRAYAGE DAF CF/XF	0	
ZEP0004536	POMPE D'EMBRAYAGE MAN TGA/TGS/TGX	0	
ZEP0015153	POMPE D'EMBRAYAGE RENAULT PREMIUM 440	0	
ZEP0004541	POMPE D'EMBRAYAGE SCANIA 360	0	
ZEP0001337	POMPE D'EMBRAYAGE SCANIA 360/380	0	
ZEP0001354	POMPE D'EMBRAYAGE VOLVO F10/F12/B12	0	
ZEP0001062	SERVEAU D'EMBRAYAGE MAN TGA/TGS/TGX	0	
ZEP0001031	SERVEAU D'EMBRAYAGE DAF/MERCEDES	0	
ZEP0001058	SERVEAU D'EMBRAYAGE RENAULT KERAX 400	0	
ZEP0010072	SERVEAU D'EMBRAYAGE RENAULT PREMIUM 440	0	
ZEP0001152	SERVEAU D'EMBRAYAGE SCANIA 360	0	
ZEP0001180	SERVEAU D'EMBRAYAGE SCANIA 380	0	
ZEP0001164	SERVEAU D'EMBRAYAGE VOLVO F10/F12/N10/NL	0	
ZEP0010316	SERVEAU D'EMBRAYAGE VOLVO FH/FM	0	
ZEP0007444	VALVE PEDAL DE FREIN STD	0	
ZEP0007372	VALVE SUSPENSSION DAF SCANIA/IVECO/SAF/SCHMITZ	0	
ZEP0007242	VALVE SUSPENSSION MAN/DAF/SCANIA/VOLVO	0	
213_15_06347	AMORTISSEUR CALANDRE MAN TGA 145MM-350N	0	
209_15_03328	AMORTISSEUR CALENDRE SCANIA 380 410 140MM/ 250N	0	
207_15_01804	AMORTISSEUR CALENDRE VOLVO FH12-FH16 530MM / 150N	0	
209_11_02838	ARRET D'HUIL MOYEU SCANIA AR 142x170x16x15	0	
207_09_01113	ARRET D'HUILE ROUE VOLVO/RENAULT 90X125X10	0	
207_02_16382	BOUCHON ADBLUE VOLVO/RENAULT/SCANIA	0	
205_04_03998	BOUCHON VASE D'EXPANSSION MAN TGA/MERCEDES	0	
209_06_14529	CABLE ACCELERATEUR SCANIA 360 114/124	0	
213_15_22470	CABLE DE PORTE CABINE MAN TGA	0	
206_15_13839	CABLE DE PORTE CABINE RENAULT PREMIUM/KERAX GM	0	
206_15_13838	CABLE DE PORTE CABINE RENAULT PREMIUM/KERAX PM	0	
209_15_03388	CAOUTCHOUC SUPPORT CABINE SCANIA 4-SERIE TRUCK	0	
206_01_13467	CAPTEUR ABS VOLVO/RENAULT/IVECO/MAN	0	
208_04_08881	CAPTEUR DE PRESSION D'AIR MAN/DAF/SCANIA/IVECO	0	
2052071G	CHAPPE DIRECTION Ø 23,5/30 LH	0	
2051526G	CHAPPE DIRECTION Ø 23,5/30 RH	0	
2011508G	CHAPPE DIRECTION Ø 27/30 LH	0	
2011507G	CHAPPE DIRECTION Ø 27/30 RH	0	
2071524F	CHAPPE DIRECTION Ø24/30 LH	0	
2071523F	CHAPPE DIRECTION Ø24/30 RH	0	
209_02_15029	CLAPIE DE GAZOIL SCANIA	0	
207_05_00758	COUPE COURANT STD	0	
213_01_21992	COUVER FILTER A HUIL MAN	0	
209_02_14999	COUVER FILTRE A GAZOIL SCANIA 360/380	0	
207_04_16232	COUVER THERMOSTAT VOLVO/RENAULT	0	
207_04_16244	DURITE INTERCOOLER VOLVO FH/FM/B9/B12 81x105x150	0	
207_04_00564	DURITE INTERCOOLER VOLVO FH/FM/B9/B12 82x106x147	0	
213_04_05603	DURITE RADIATEUR MAN TGA/TGS 59x70x390	0	
209_07_30446	DURITE RADIATEUR SCANIA 380	0	
209_04_21526	DURITE RADIATEUR SCANIA 50/56x430	0	
207_04_16183	DURITE RADIATEUR VOLVO FH	0	
209_04_20723	DURITE RETARDEUR SCANIA	0	
213_03_05495	FLEXIBLE ECHAPPEMENT MAN TGA/TGS/TGX 110X 443	0	
213_15_06395	KIT CABINE MAN TGA/TGS	0	
206_15_25253	KIT CABINE RENAULT PREMIUM 420	0	
2134494	KIT SUPPORT GUIDAGE MAN/MERCEDES/DAF 85x130x19	0	
2077054	KIT SUPPORT GUIDAGE Ø75x115xØ19	0	
2135399	KIT SUPPORT GUIDAGE Ø85x130xØ25	0	
213_07_22217	POIGNET DE LEVIER VITESSE MAN TGA/TGS/TGX 8V GOUPILLE	0	
206_07_30447	POIGNET DE LEVIER VITESSE RENAULT PREMIUM	0	
209_15_03402	POMPE CABINE SCANIA N.M	0	
213_02_15903	POMPE D'ALIMENTATION MAN TGA	0	
208_06_09086	POMPE D'EMBRAYAGE DAF CF/XF	0	
213_10_06027	SILENT BLOC BARRE STABILISATRICE MAN 55x83x70	0	
213_15_06385	SILENT BLOC CABINE MAN TGA/TGS/TGX	0	
213_15_06366	SILENT BLOC CABINE MAN TGA/TGS/TGX 80c16,5x60	0	
223_10_14282	SILENT BLOC LAME RESSORT BPW-ROR 30x57x102	0	
213_10_05917	SILENT BLOC LAME RESSORT MAN TGA/TGS/TGX 95x24x62	0	
205_10_04342	SILENT BLOC LAME RESSORT RENAULT 440 24x62x95	0	
207_10_08737	SILENT BLOC LAME RESSORT VOLVO AR 110x20x52	0	
201_10_23112	SILENTBLOC RESSORT IVECO 32,5x37x65	0	
208_04_08864	TENDEUR DE COURROIE DAF CF85/XF95	0	
208_04_08866	TENDEUR DE COURROIE DAF XF 105	0	
213_04_05678	TENDEUR DE COURROIE MAN TGA/TGS/TGX	0	
209_04_02377	TENDEUR DE COURROIE SCANIA 360	0	
209_07_02504	TRIANGLE DE COMMANDE VITESSE	0	
213_13_22821	TUBE COMPRESSEUR MAN TGA/TGS/TGX	0	
213_13_22822	TUBE COMPRESSEUR MAN TGA/TGS/TGX	0	
201_04_26556	VASE D'EXPANSSION IVECO STRALIS/TRAKKER	0	
206_04_13883	VASE D'EXPANSSION RENAULT PREMIUM/KERAX	0	
213_02_22080	VERRE FILTRE CARBURANT MAN TGA	0	
309-0483	BARRILET DE PORTE CABINE VOLVO FH/FM	0	
526-846	BOUCHON ADBLUE DAF/MERCEDES	0	
210-6027	BOUCHON RESERVOIR STD D80	0	
979-593	BOUCHON VASE D'EXPANSSION VOLVO/RENAULT	0	
414-372	CABLE ACCELERATEUR SCANIA 360 114/124	0	
680-0132	CABLE DE PORTE CABINE MAN TGA	0	
498-712	CABLE DE PORTE CABINE SCANIA 360/380	0	
922-589	CABLE DE PORTE CABINE VOLVO FH/FM	0	
789-683	CABLE VITESSE VOLVO FH NOIR 2650mm	0	
545-955	CABLE VITESSE VOLVO FH/FM GRIS 2915mm	0	
303110004	valve de boite a vitesse	0	
381-957S	BOUCHON CARTER D'HUIL SCANIA	0	
176-136	CABLE DE REGLAGE DE LACOLONNE DE DIRECTION	0	
870-062	CABLE VITESSE RENAULT PREMIUM/KERAX	0	
383-063	CACHE BALANCIER SCANIA 360	0	
697-325	CAPTEUR DE PRESSION D'AIR MAN/DAF/SCANIA/IVECO	0	
482-562	CAPTEUR DE PRESSION D'HUIL SCANIA 360	0	
252-439	CAPTEUR DE TEMPERATURE DAF CF/XF	0	
421-0190	CAPTEUR DE TEMPERATURE MAN TGA/TGS/TGX/F2000	0	
412-450	CAPTEUR DE TEMPERATURE VOLVO/RENAULT	0	
448-082	CAPTEUR NIVEAU DE SUSPENSSION DAF/RENAULT/SCANIA	0	
985-226	CAPTEUR PEDAL D'ACCELERATEUR VOLVO FH/FM	0	
524-936	CAPTEUR PEDAL D'ACCELERATEUR VOLVO/RENAULT	0	
504-685	CAPTEUR PEDAL D'ACCELERATEUR VOLVO/RENAULT	0	
172-171	COMODO DE SIGNAL VOLVO FH/FM/B7/B9/B10	0	
070-1049	COMODO D'ESSUIS-GLACE VOLVO FH/FM/B7/B9	0	
484-914	COUVER THERMOSTAT SCANIA	0	
478-655	COUVER THERMOSTAT SCANIA	0	
864-077	COUVER THERMOSTAT SCANIA	0	
484-919	COUVER THERMOSTAT SCANIA	0	
343-100	DOUILLE SUSPENSSION DE LA CABINE SCANIA	0	
315-483	DURITE INTERCOLER 90X260 PREMIUM 420	0	
301-0900	DURITE INTERCOOLER MAN 8R	0	
945-582	DURITE INTERCOOLER MERCEDES ACTROS 115x120	0	
305-0134	DURITE RADIATEUR MAN	0	
377-231	DURITE RADIATEUR SCANIA	0	
878-891	DURITE RADIATEUR SCANIA 380	0	
373-919	DURITE RADIATEUR SCANIA SERIE 4	0	
402-0188	DURITE TURBO MAN/TGA/TGS/TGX	0	
210-0086	FLEXIBLE D'ECHAPPEMENT MAN TGA/TGS/TGX	0	
107-8115	FLEXIBLE D'ECHAPPEMENT VOLVO 115x500	0	
107-8110	FLEXIBLE D'ECHAPPEMENT VOLVO 128x132x370	0	
921-895	JOINT REFROIDISSEUR D'HUIL SCANIA P380	0	
481-245S	KIT CABINE SCANIA	0	
324-713S	KIT CABINE SCANIA	0	
377-562S	KIT CABINE SCANIA 16x60x80	0	
676-594	PIPE D'HUIL VOLVO FH	0	
555-313	PIPE POMPE A EAU VOLVO/RENAULT	0	
285-260	POIGNET DE LEVIER DE VITESSE DAF CF/XF	0	
727-377	POIGNET DE LEVIER DE VITESSE SCANIA 360	0	
727-378	POIGNET DE LEVIER DE VITESSE SCANIA 380	0	
1400030100	KIT COMPRESSEUR SC SERIE3/SERIS4/BUS	0	
425302F	VENTEUZE DE CABINE AV RENAULT PREMIUM/KERAX	0	
080.238	VT-VENTEUZE CABINE RVI KERAX AV 92X115	0	
2221201	CLAPET CHARGE RAPIDE VOVLO M16 X	0	
KU0497	PIVOT SANS CUVET MF 1712	0	
450-903	POMPE CABINE DAF CF/XF	0	
723-6044	POMPE CABINE MAN TGA/TGS/TGX	0	
316-438	POMPE CABINE RENAULT PREMIUM/KERAX	0	
378-531	POMPE CABINE SCANIA 360	0	
794-906	POMPE CABINE SCANIA R410	0	
800-6099	POULIE DE TENDEUR MAN TGA/TGS/TGX 73x34	0	
514-087	POULIE DE TENDEUR SCANIA 360	0	
858-884	POULIE DE TENDEUR SCANIA 360/380	0	
761-057	POULIE DE TENDEUR SCANIA 380	0	
860-733	POULIE DE TENDEUR SCANIA P380	0	
384-624	ROUTULE LEVIER DE VITESSE SCANIA	0	
210-0019	SILENT BLOC CABINE MAN TGA/TGS/TGX	0	
602-00004	SILENT BLOC CABINE MAN TGA/TGS/TGX	0	
316-015	SILENT BLOC CABINE RENAULT PREMIUM/KERAX	0	
394-544	SILENT BLOC CABINE SCANIA 360 80x16x60	0	
228-947	SILENT BLOC CABINE VOLVO/RENAULT	0	
316-9000	SILENT BLOC LAME RESSORT BPW-ROR 30x57x102	0	
533-294	SILENT BLOC LAME RESSORT VOLVO AR 110x20x52	0	
496-749	SUPPORT MOTEUR AV SCANIA 124	0	
614-600	SUPPORT MOTEUR VOLVO F10/N10	0	
564-240	SUPPORT VENTULATEUR VOLVO FH/FM	0	
752-918	SWITCH DE COMMANDE VOLVO FH/FM	0	
5800-7477	TENDEUR DE COURROIE MAN TGA/TGS/TGX	0	
870-551	TENDEUR DE COURROIE SCANIA 410	0	
404-925	THERMOSTAT SCANIA 4 SERIE 80°C GM	0	
431-979	THERMOSTAT SCANIA P/G/R/T 75°C PM	0	
544-683	THERMOSTAT VOLVO/DAF/RENAULT 82°C	0	
662-413	VALVE BOIT DE VITESSE STD	0	
172-628	VALVE BOIT VITESSE VOLVO FH/FM	0	
672-231	VALVE BOIT VITESSE VOLVO FH/FM	0	
106-8951	VALVE BOIT VITESSE VOLVO FH/FM	0	
583-428	VALVE SUSPENSSION VOLVO/RENAULT	0	
960-437	VASE D'EXPANSSION DAF EURO6	0	
102-6219	VASE D'EXPANSSION MAN	0	
101-7015	VASE D'EXPANSSION RENAULT PREMIUM/KERAX	0	
421-090	VASE D'EXPANSSION SCANIA 360/380	0	
AT2001L	PLAQUE DE REMORQUE PM LEDS 12/24V	0	
AT2001-NEON	PLAQUE DE REMORQUE PM AT2001-LEDS NEON	0	
03RF0503	PRISE REMORQUE 24V FEMELLE METAL TYPE N	0	
AT53J	FEU DE POS RECT JAUNE AT53-0	0	
AT55R	REFLECTEUR RECT 43X180 ROUGE AT55-R	0	
MR-17J	GYROPHARE 2POS- LED ORANGE BURNERS	0	
AT953R	REFLECTEUR FLECHE ROUGE	0	
AT953J	REFLECTEUR FLECHE ORANGE	0	
ROOF	PLAFONNIER 84 LED 300X125 12/24V	0	
TD0563138L1	FEU AR UNIVERSEL FEU PLAQUE REFLECHEUR	0	
TD0563138R1	FEU AR UNIVERSEL FEU PLAQUE REFLECHEUR	0	
AT403R	FEU DE POS DIA 68MM ROUGE TASSIL	0	
LS508-S	FEU DE CHANTIER CARRE LED 9-36V BLANC	0	
MANC311254	FILTRE A AIR SCANIA	0	
MANC271340	FILTRE A AIR VOLVO/SCANIA	0	
0803YLT	CACHE OPTIQUE G VOVLO FH12-16	0	
0803YRT	CACHE OPTIQUE D VOVLO FH12-16	0	
EML0030CT	CABOUCHON AR/G AVEC TRIANGLE	0	
EMR0030CT	CABOUCHON AR/D AVEC TRIANGLE	0	
56852	A.H MOYEAU DAF	0	
HD-05-S-015	PHARE SECOURS SCANIA SERIE 6 GH	0	
HD-05-S-016	PHARE SECOURS SCANIA SERIE 6 DR	0	
75838	COIN PARECHOC MAN TGS DR	0	
82343	JOINT THERMOSTAT RVI 440 VOLVO FM-FH OEM 215	0	
HD-01-D-046	CEINTURE DE AILE DAF XF95/ XF95/ XF105	0	
HD-01-D-137	RETROVISEUR DAF XF105 GM	0	
HD-01-D-139	RETROVISEUR DAF XF105 PM	0	
HD-01-S-004	FEU AV SCANIA 113 DR	0	
HD-01-S-005	FEU AV SCANIA 113 GH	0	
HD-02-B-040	RETROVISEUR MERCEDES ACTROS MP1 SUP	0	
HD-02-B-041	RETROVISEUR MERCEDES ACTROS MP1INF	0	
HD-02-D-026	POIGNET EXT DAF CF GH	0	
HD-02-M-076	RETROVISEUR MAN TGA/TGS PORTE	0	
HD-02-R-005	GLACE OPTIQUE RVI	0	
HD-02-R-071	RETROVISEUR RVI PREMIEUM 2/3 G/D PORTE	0	
HD-02-R-101	BOUCHON RESERVOIRE RVI 5001864551 /68659	0	
HD-02-R-137	REGLAGE DE SIEGE OEM 0009107238 /81751 STD	0	
HD-02-S-014	SUPPORT OPTIQUE SCANIA 114 P/R DR	0	
HD-02-S-193	RETROVISEUR SCANIA SC114 PORTE	0	
HD-03-B-001	OPTIQUE MERCEDES ACTROS MP2 DR	0	
HD-03-B-002	OPTIQUE MERCEDES ACTROS MP2 GH	0	
HD-03-D-003	FEU AR STOP DAF EURO 6 XF106 DR	0	
HD-03-D-004	FEU AR STOP DAF EURO 6 XF106 GH	0	
MR1043	FILTRE A AIR 2114402 DAF430	0	
131180000100	FEUX AR CARRE 3 FONCTIONS	0	
HD-03-S-027	PARECHOC SCANIA P420 DR(COIN)	0	
HD-03-S-029	PARECHOC SCANIA P420 GH (COIN)	0	
030.307	AM-AMOURTISSEUR CABINE AVANT VOVLO FH FM	0	
HD-04-S-085	CACHE FILTRE A AIR SCANIA 420 77215	0	
HD-04-V-016	FEU POSITION VOVLO FH/FM V2	0	
HD-04-V-017	CACHE DE ROUE VOVLO FH/FM V2	0	
HD-05-V-001	OPTIQUE VOLVO FH/FM V3 DR	0	
HD-05-V-002	OPTIQUE VOLVO FH/FM V3 GH	0	
HD-05-V-005	FEU AV VOLVO FH/FM V3 DR	0	
HD-05-V-010	SOCLE PHARE SECOURS VOLVO FH/FM V3 DR	0	
HD-05-V-011	SOCLE PHARE SECOURS VOLVO FH/FM V3 GH	0	
HD-05-V-017	SOCLE OPTIQUE VOLVO FH/FM V3 GH	0	
HD-05-V-087	RETROVISEUR VOVLO FH/FM V3 PORTE	0	
PU100032X	FILTRE A GAZOIL SCANIA KIT DE3158	0	
078.309-01	AM-AMOURTISSEUR CABINE VOVLO FH PLAZMA	0	
DF-09373XX	HUILE DAF 15W40 20L TRP	0	
752424	VASE RLT SOLO 4 TROU 11 CM	0	
292051	RELAIS PRECHAUFFAGE 4F 12V RNT-PGT-CIT	0	
292052	RELAIS PRECHAUFFAGE 4F 12V RNT-PGT-CIT	0	
SP-096.407-01	SP 096.407-01 VALVE REGLAGE DE SUSP PNEUMA DAF RVI OEM:1934584	0	
SP-043.113-01	SP-043.113-01 VENTEUZE AVEC AMORTISSEUR SUSPENSION CABINE SCANIA 410	0	
SP-030.270-01	SP-030.270-01 VENTEUZE AC AMORTI SUSPCABINE VOVLO FH12 AV OEM:3172984	0	
APV1051	TENDEURS DE COURROIES DE STRIEE SCANIA 124/142/143/144 1383564	0	
APV2706	Poulie renvoi/transmission,courroie trapézoidale à CATERPILLAR 3126 VOVLO FL	0	
APV2689	Poulie renvoi/transmission,courroie trapézoidale à nervures 74X32	0	
APV2729	Tendeur de courroie,courroie trapézoïdale à SCANIA -P.G.R.T-se	0	
8PK1535	Courroie trapézoïdale à nervures SCANIA	0	
APV2688	Poulie renvoi/transmission,courroie trapézoidale à nervures 74X46 MAN	0	
KU0498	PIVOT AVEC CUVET MF 1711-2	0	
35446	VALVE MULTIPLIER 4T VOLVO OEM 1669297	0	
FE439	PHARE SECOURS 20211-3) 10-36V	0	
M_611252	FEU AR D DAF LF	0	
M_611253	FEU AR G DAF LF	0	
CA155	SERRURE DM INOX TRIPORTEUR PM	0	
21133	PHARRE SECOURD	0	
C207_OR_C_OR	GYROPHARE	0	
SE036	REFLECTEUR GM R/BL SIMPLE 5 MM	0	
10550	TUISSE LOG	0	
WSK.56	NEC APPAREIL REMORQUE FRF	0	
MAN31014	FITRE AIR SCANIA CROMPO	0	
842	RELAIS MIT MERCEDES ACTROS	0	
703141400	COLLE DE JOINTS REINZ	0	
819052	ANTIGEL 5L -25° VERT	0	
1987947613	10X1000 COURROIE BOSCH	0	
1987947640	10X1050 COURROIE BOSCH	0	
1987947644	10X1150 COURROIE BOSCH	0	
1987947646	10X1200 COURROIE BOSCH	0	
1987947647	10X1300 COURROIE BOSCH	0	
1987947657	13X1075 COURROIE BOSCH	0	
1987947658	13X1100 COURROIE BOSCH	0	
1987947659	13X1125 COURROIE BOSCH	0	
3397015409	X1 BALAI MAN/SCANIA/RENAULT/MERCEDES 65 =N65	0	
29211A	PLAQUETTES DE FREINS PL	0	
6010001	FERMETURE 152.06.001.01	0	
KU1710	CUVET MF1710	0	
MR286	FL A AIR SCANIA 124G	0	
9.9027.1	FLASHEUR 12V 3F A/SUPPORT	0	
99560	APPAREIL TEMERATURE ELEC 12V	0	
EMR0030L+EML0030L	FEU ARRIERE 6 CHAMBRES G/D PC	0	
080.354	BT-CHAPPE LEVIER VITESSE RENAULT KERAX	0	
CA350	SERRURE TRIPORTEUR T022-04/GLV	0	
468_77_005	POMPE CABINE RENAULT KERAX	0	
ZEP0003533	CULASSE COMPRESSEUR MAN TGA/TGS/TGX	0	
ZEP0002377	KIT COMPRESSEUR SCANIA	0	
AH_1736562_SCANIA	MTF535-DSK ARRET D HUILE SCANIA 145X170X14.5/18	0	
FT-130COF-LED	FEU AR LED 6 UNIVERSEL 12V/24V	0	
CA082	SABOT 24.2CM/8CM	0	
MANWA940_18	FILTRE A EAU DAF 95XF	0	
MM323	FL GAZOIL A HUILE VOLVO/RVI T.TYPE SCANIA	0	
MZ288	FILTRE A HUILE IVECO 2992544	0	
MR284	FL A AIR RVI KERAX -INT R404 27.284.16	0	
BOSK.1.6	NEC VALVE D AIR VOVLO OEM 590340	0	
8PK2043HD	Courroie SCANIA 144 C-G-L Mtr. DSC 14/13	0	
8PK1635HD	Courroie trapézoïdale à nervures MAN - TGA	0	
042.361	BT-ROISILLON BOITE VITESSE SCANIA P360	0	
050.495	PASTILLE D'EAU DAF 45 MM	0	
040.198	SUPPORT RADIATEUR SCANIA G	0	
040.199	SUPPORT RADIATEUR SCANIA D	0	
050.584	BT-KIT REPPARATION FORCHETTE EMBRAYGE	0	
040.092	X-AMORTISSEUR CALENDRE SCANIA 113-143	0	
040.093	X-AMORTISSEUR CALENDRE SCANIA 124-144	0	
1830_0048	X-GARDE BOUE VOLVO FH FM	0	
043.200	X-MANIVELLE VITRE SCANIA /G	0	
043.199	X-MANIVELLE VITRE SCANIA /D	0	
1820_0040	X-CORPS MARCHE PIED MAN TGA TGX TGS -XXL	0	
252_11_001	CABLE VITESSE VOLVO FH NOIR 2650mm	0	
184_00_014	BOUCHON RESERVOIRE VOLVO/RENAULT	0	
0104054	COUVERCLE DE FILTRE SCANIA	0	
4001	BARADHL STOP FUITE RADIATEUR 300ml	0	
100610	PORTE FUSIBLE A 4 LAMES	0	
12132010NG	CABLE SV1V 2X1 mm² ING	0	
YF-314	FILTRE A GAZOIL MIT FIGHTER -FK 415	0	
YFC-317	FILTRE A GAZOIL MIT CANTER NM- HY HD65	0	
YFC-318	FILTRE A GAZOIL MIT CANTER HD ME016823	0	
YC_223	FILTRE A HUILE MIT FIGHTER FUSO N/M +FK	0	
YC-305	FILTRE A HUILE MIT CANTER ME014838	0	
YC-310	FILTRE A HUILE MIT CANTER NM SANA VIS	0	
YF_336	FILTRE A GAZOIL MIT FIGHTER 2015+-NISSAN	0	
YF_3-F1009	FILTRE A GAZOIL MIT CANTER AM CARTOUCHE	0	
YF667920	FILTRE A GAZOIL MIT CANTER FUSO MK667920	0	
YO_362	FILTRE A HUILE MIT CANTER FUSO NM QC000001	0	
2825	LAMPE 12V 5W T/B S/BASE	0	
MANC271250_1	FILTRE A AIR MAN TGA-TGS-TGX	0	
MANCF1640	FILTRE A AIR IVECO/MAN	0	
29246A	PLAQUETTES DE FREINS	0	
WAB_4329012532	WAB_4329012532 CARTOUCHE DESSICATEUR DAF EURO 6	0	
WAS_4324109272	WAS_4324109272 KIT CARTOUCHE SCANIA	0	
48728	H7 24V 70W PX26d=13972philips	0	
17916	LAMPES P21/5W 12V21/5W BAY 15D	0	
48321	LAMPES H3 12V 55W	0	
18032	LED H4 RPL2	0	
18033	LED H7 RPL2	0	
18058	H3	0	
131130000100	FEUX DE POSITION JAUNE	0	
3206.0077760	BALAI ESSUIS GLACE CAMION 24 60CM	0	
3206.0077765	BALAI ESSUIS GLACE CAMION 24 65CM	0	
3206.0077770	BALAI ESSUIE GLACE CAMION 28 70CM	0	
3397015410	BALAIS MERCEDES/MAN/SCANIA/RENAULT	0	
WK1080_7X	FILTRE A GAZOIL	0	
19879476665	13X1275 COURROIE BOSCH	0	
SP_078.309-01	SP_078.309-01 VENTEUZE AVEC AMOURTISSEURSUSPENTION VOLVO FH16 FH16A	0	
12135015NG	CABLE SV1V 5X1.5 mm² ING	0	
10951150NR	PROJECTEUR LED IP65 50W NOIR	0	
ELC-UNV-0025	CONTACT PRECHAUFFAGE GM STD	0	
31220	MANO TEMPERATURE 31220 STD CULASSE	0	
